{"schema_version":"personal-plan-launch-v1","batch_id":"personal-plan-launch-v1","product_key":"balea-professional-aha-scalp-peeling","category_key":"scalp_care","lifecycle_classification":"new_product","identity":{"canonical_brand":"Balea","product_line":"Professional","clean_name":"Kopfhautpflege Peeling Tiefenreinigung","size_variant":"150 ml","identifiers":[{"type":"gtin","value":"4066447467536","source":"dm"},{"type":"retailer_sku","value":"dm:1700670","source":"dm"}]},"duplicate_check":{"checked_at":"2026-08-09T09:19:32Z","candidates":[]},"sources":[{"label":"dm Produktseite","type":"retailer","url":"https://www.dm.de/p/d/1700670/balea-professional-kopfhautpflege-peeling-tiefenreinigung"}],"commercial":{"purchase_url":"https://www.dm.de/p/d/1700670/balea-professional-kopfhautpflege-peeling-tiefenreinigung","status":"available","price_eur":2.95,"currency":"EUR","checked_at":"2026-08-09T09:19:32Z","availability_blocker":null},"catalog_state":{"origin":"curated","is_active":true,"lifecycle_status":"active","is_chaarlie_recommended":true},"image":{"local_asset_path":"ops/catalog-enrichment/personal-plan-launch-v1/scalp/balea-professional-aha-scalp-peeling/images/final/balea-professional-aha-scalp-peeling-478290983df3.webp","expected_storage_path":"catalog-enrichment/personal-plan-launch-v1/scalp/balea-professional-aha-scalp-peeling/balea-professional-aha-scalp-peeling-478290983df3.webp","final_sha256":"478290983df3c1395927ce2fd13e13fe3944c57bc8fe18783def8f7ef9c90893"},"product_payload":{"final":{"product":{"canonical_brand":"Balea","product_line":"Professional","clean_name":"Kopfhautpflege Peeling Tiefenreinigung","category_key":"scalp_care","affiliate_link":"https://www.dm.de/p/d/1700670/balea-professional-kopfhautpflege-peeling-tiefenreinigung","image_url":null,"price_eur":2.95,"currency":"EUR","purchase_link_status":"available","purchase_link_checked_at":"2026-08-09T09:19:32Z","price_checked_at":"2026-08-09T09:19:32Z"},"identifiers":[{"type":"gtin","value":"4066447467536","source":"dm"},{"type":"retailer_sku","value":"dm:1700670","source":"dm"}],"category_specs":{"product_scalp_care_specs":{"primary_role":"scalp_exfoliant","presentation_format":"scrub","rinse_mode":"rinse_off","application_instructions":"Auf die Kopfhaut auftragen, leicht einmassieren, 15 bis 20 Minuten einwirken lassen und anschliessend mit Shampoo ausspuelen."},"product_application_protocols":[{"category":"scalp_care","role":"scalp_exfoliant","cadence":{"type":"as_needed","source":"category_fallback"},"application_stage":"pre_shampoo","application_state":null,"placement":"scalp","contact_time_seconds":900,"rinse_action":"rinse_with_shampoo","reapplication":"not_stated","instruction_modifiers":["contact_time_range_seconds=900-1200","cadence not manufacturer-stated","do not auto-stack with Deep Cleansing"],"source_label":"dm PDP","source_url":"https://www.dm.de/p/d/1700670/balea-professional-kopfhautpflege-peeling-tiefenreinigung","source_text":"Auf Kopfhaut auftragen, leicht einmassieren, 15-20 Minuten einwirken lassen, mit Shampoo ausspuelen."}]},"sources":[{"url":"https://www.dm.de/p/d/1700670/balea-professional-kopfhautpflege-peeling-tiefenreinigung","title":"dm Produktseite","evidence":"Identitaet, Verfuegbarkeit, Preis und Anwendung."}],"field_rationales":{"product.canonical_brand":"Approved exact data board","product.clean_name":"Approved exact data board","product.category_key":"Nick-approved role","product.affiliate_link":"Approved retailer page","product.image_url":"B0 unresolved until B1 upload verification","product.price_eur":"Approved exact data board","product.purchase_link_status":"Approved exact data board","category_specs.product_scalp_care_specs":"Hair Concierge fallback; no Deep Cleansing replacement","category_specs.product_application_protocols":"Hair Concierge fallback; no Deep Cleansing replacement"},"review":{"manual_reviewed":true,"reviewed_by":"nick","reviewed_at":"2026-08-09T09:53:24Z"}}},"category_payload":{"product_scalp_care_specs":{"primary_role":"scalp_exfoliant","presentation_format":"scrub","rinse_mode":"rinse_off","application_instructions":"Auf die Kopfhaut auftragen, leicht einmassieren, 15 bis 20 Minuten einwirken lassen und anschliessend mit Shampoo ausspuelen."},"product_application_protocols":[{"category":"scalp_care","role":"scalp_exfoliant","cadence":{"type":"as_needed","source":"category_fallback"},"application_stage":"pre_shampoo","application_state":null,"placement":"scalp","contact_time_seconds":900,"rinse_action":"rinse_with_shampoo","reapplication":"not_stated","instruction_modifiers":["contact_time_range_seconds=900-1200","cadence not manufacturer-stated","do not auto-stack with Deep Cleansing"],"source_label":"dm PDP","source_url":"https://www.dm.de/p/d/1700670/balea-professional-kopfhautpflege-peeling-tiefenreinigung","source_text":"Auf Kopfhaut auftragen, leicht einmassieren, 15-20 Minuten einwirken lassen, mit Shampoo ausspuelen."}]},"planned_operations":[{"type":"insert_product","table":"products","catalog_content":{"name":"Kopfhautpflege Peeling Tiefenreinigung","brand":"Balea","category":"scalp_care","affiliate_link":"https://www.dm.de/p/d/1700670/balea-professional-kopfhautpflege-peeling-tiefenreinigung","purchase_link_status":"available","purchase_link_checked_at":"2026-08-09T09:19:32Z","price_checked_at":"2026-08-09T09:19:32Z","price_eur":2.95,"currency":"EUR","image_asset_path":"catalog-enrichment/personal-plan-launch-v1/scalp/balea-professional-aha-scalp-peeling/balea-professional-aha-scalp-peeling-478290983df3.webp","image_sha256":"478290983df3c1395927ce2fd13e13fe3944c57bc8fe18783def8f7ef9c90893","origin":"curated","is_active":true,"lifecycle_status":"active","is_chaarlie_recommended":true,"brand_id":null,"product_line_id":null,"image_url":null}},{"type":"upsert","table":"product_scalp_care_specs","rows":[{"product_id":"__PRODUCT_ID__","primary_role":"scalp_exfoliant","presentation_format":"scrub","rinse_mode":"rinse_off","application_instructions":"Auf die Kopfhaut auftragen, leicht einmassieren, 15 bis 20 Minuten einwirken lassen und anschliessend mit Shampoo ausspuelen."}]},{"type":"upsert","table":"product_application_protocols","rows":[{"product_id":"__PRODUCT_ID__","category":"scalp_care","role":"scalp_exfoliant","cadence":{"type":"as_needed","source":"category_fallback"},"application_stage":"pre_shampoo","application_state":null,"placement":"scalp","contact_time_seconds":900,"rinse_action":"rinse_with_shampoo","reapplication":"not_stated","instruction_modifiers":["contact_time_range_seconds=900-1200","cadence not manufacturer-stated","do not auto-stack with Deep Cleansing"],"source_label":"dm PDP","source_url":"https://www.dm.de/p/d/1700670/balea-professional-kopfhautpflege-peeling-tiefenreinigung","source_text":"Auf Kopfhaut auftragen, leicht einmassieren, 15-20 Minuten einwirken lassen, mit Shampoo ausspuelen."}]}],"validation":{"state":"ready_for_handoff","blockers":[],"b1_resolutions":null,"data_review_board_sha256":"f029e5ab9f92e4384075cf30f621007d06a094add9d40ca6f5ac446884de6263","final_image_approval_receipt_sha256":"e32f22b54f1b6a8781306c512c22ac8f7a4ad744cf7d09a058990b621cc2f3b6"},"review":{"state":"approved","reviewed_content_fingerprint":"941b33208a009458e98686319c73c856902f5529fbe99812cfbdee9eef817281"},"disposition":{"state":"approved_for_deliverable_b","may_enter_deliverable_b":true}}
